diseasename,place,country,lat,lon,summary,issue_date,region/city,region/city lat,region/city lon,cases,deaths,total cases,total deaths
Crimean-Congo Hemorrhagic Fever,"Punjab Province, Pakistan",Pakistan,31,72,"A young woman suffering from Crimean-Congo hemorrhagic fever [CCHF], commonly referred to as Congo fever, died in Rawalpindi on Friday [27 Sep 2019], Dunya News reported. CCHF is a tick-borne viral disease which is mainly transferred to humans from pets. Its symptoms include fever, flu, bloody urine, vomiting and nose bleeding.",2019-09-29,Rawalpindi,33.59733,73.0479,,1,,
Crimean-Congo Hemorrhagic Fever,"Sindh, Pakistan",Pakistan,26,69,"A man was diagnosed with the disease after being admitted at Jinnah hospital Karachi on [Fri 20 Sep 2019]. The tick-borne viral disease has infected 37 people this year [2019] so far; out of which 17 died. The alert was issued by Karachi Metropolitan Corporation (KMC) to hospitals, directing the management to adopt special precautions for a CCHF affected patient.",2019-09-24,Karachi,24.8608,67.0104,1,,37,17
Crimean-Congo Hemorrhagic Fever,"Karachi, Sindh, Pakistan",Pakistan,25,67,"The deadly Congo [Crimean-Congo hemorrhagic] virus has 'attacked' Karachi, the largest city of Pakistan, killing at least 20 people so far this year [2019] The latest to die because of the Congo virus on [Mon 11 Nov 2019] was a man who had been admitted to a hospital. The majority of cases have occurred in people involved in the livestock industry.",2019-11-13,Karachi,24.8608,67.0104,1,,,20
Crimean-Congo Hemorrhagic Fever,Pakistan,Pakistan,30,69,"10 people, including an ambulance crew, were hospitalized in Southern Kazakhstan Oblast on suspicions of carrying a deadly virus. Crimean-Congo hemorrhagic fever (CCHF) was the probable cause. CCHF has a high fatality ratio of 10 to 40 per cent and is difficult for treatment and prevention.",2014-07-12,Republic of Kazakhstan,48,68,10,,,
Crimean-Congo Hemorrhagic Fever,"Khyber Pakhtunkhwa Province, Pakistan",Pakistan,35,72,A factory worker in Khyber-Pakhtunkhwa died of high grade-fever with the family blaming death on Crimean-Congo haemorrhagic fever. The family claimed that the PIMS doctors suspected its member suffered from Congo fever. Another villager also tested positive for CCHF.,2019-10-06,Khyber Pakhtunkhwa Province,33.98306,71.68611,1,1,,
Crimean-Congo Hemorrhagic Fever,"Sindh, Pakistan",Pakistan,26,69,"A man died of Congo fever [CCHF] on Thursday [17 Oct 2019] night, taking the death toll from the disease in the country to 19. The deceased has been identified as 50-year-old YH, a farmer from Mirpurkhas. He died during treatment at the Liaquat Medical Hospital in Hyderabad. The directorate general of health services has recommended that Congo virus surveillance be improved immediately.",2019-10-20,Hyderabad,17.38405,78.45636,,1,,19
Crimean-Congo Hemorrhagic Fever,"Karak, Khyber Pakhtunkhwa, Pakistan",Pakistan,33,71,"A young man has fallen prey to Congo virus [Crimean-Congo hemorrhagic fever, CCHF], raising the death toll from the disease to 7 in the Karak district. The latest victim, [a man from] Sarki Lawagher area, died in the Lady Reading Hospital in Peshawar after suffering from the virus for more than a week, according to relatives.",2017-11-02,Karak,31.18763503,35.68754327,,1,,7
Crimean-Congo Hemorrhagic Fever,Afghanistan,Afghanistan,34,66,"An outbreak of acute haemorrhagic fever syndrome has been reported from anisolated village in Gulran district, Afghanistan. Disease symptoms arecompatible with Crimean-Congo haemOrrhagic Fever (CCHF) Twenty-five suspect cases including 15 deaths were identified by the team.",2000-06-24,Gulran,35.1055,61.68733,25,15,,
Crimean-Congo Hemorrhagic Fever,Afghanistan,Afghanistan,34,66,"Only 35 cases of the virus have been reported in the Pakistani-Afghan frontier region and only 4 people are currently being treated. ""Nothing suggests it will get worse,"" said Ian Simpson of the WHO. The WHO also dismissed rumors that the disease was being spread as biological warfare.",2001-10-10,,,,35,,,
Crimean-Congo Hemorrhagic Fever,Afghanistan,Afghanistan,34,66,"Four butchers died after being infected with Crimean-Congo hemorrhagic fever virus [CCHF] virus in September 2013. People in areas of Punjab, K-P and Balochistan have been exposed to the deadly virus. People think that because of its name, CCHF virus cannot be found in Pakistan, which is an ignorant assumption.",2013-10-07,,,,,4,,
Crimean-Congo Hemorrhagic Fever,Afghanistan,Afghanistan,34,66,"Crimean Congo hemorrhagic fever (CCHF) is endemic in the region of northwestern Pakistan/Afghanistan and neighboring Iran. Only the 2nd case was laboratory confirmed, but the bleeding symptoms of the others strongly suggested CCHF. The 3 patients are in addition to the 3 reported in previous posts (see ProMED-mail archives below)",2014-05-28,,,,3,0,,
Crimean-Congo Hemorrhagic Fever,Afghanistan,Afghanistan,34,66,"A man, a man, 38 years old, with co-morbidity (viral hepatitis C) from Jalalabad [Nangarhar province], Afghanistan, with a short history [4 days only] of high grade fever and bleeding from the mouth and nose, landed at Northwest General private hospital Peshawar [Khyber-Pakhtunkhwa province, Pakistan] on 5 May 2015. He was treated as a chronic liver disease patient and a splenectomy was planned to correct the thrombocytopenia. However, this patient was transferred to Maroof International Hospital Islamabad [Pakistan] on 7 May [2015] on the request of relatives, but against",2015-05-15,Jalalabad,21,57,1,,,
Crimean-Congo Hemorrhagic Fever,Afghanistan,Afghanistan,34,66,"The number of patients from Afghanistan arriving in the city for medical treatment has increased over the last 2 months. At least 9 suspected virus-carriers have been brought to the provincial capital [Peshawar] for treatment during last two months. The Crimean-Congo haemorrhagic fever [CCHF], commonly known as Congo virus, is endemic in Afghanistan and Pakistan.",2015-06-25,Peshawar,34.008,71.57849,9,,,
Crimean-Congo Hemorrhagic Fever,Afghanistan,Afghanistan,34,66,A patient died at the Hayatabad Medical Complex here on Saturday [1 Aug 2015] from Crimean-Congo hemorrhagic fever virus [CCHFV]. There are 3 patients being treated at the hospital from the virus [infection]. The patient who died is from Afghanistan. It is not clear whether the other 2 patients are also from there or are from Pakistan.,2015-08-03,Peshawar,34.008,71.57849,3,1,,
Crimean-Congo Hemorrhagic Fever,Afghanistan,Afghanistan,34,66,"A 49 year old man from Afghanistan succumbed to the deadly viral disease at the Aga Khan University Hospital (AKUH) on Sunday. The man had been brought from Kabul by road and admitted to the private hospital on 21 Aug [2016], his nephew said. The fatality occurred amid deaths of dozens of sacrificial animals in mysterious circumstances at the cattle market set up along Super Highway.",2016-09-01,Peshawar,34.008,71.57849,1,1,,
Crimean-Congo Hemorrhagic Fever,Afghanistan,Afghanistan,34,66,"At least 12 people have died from Congo fever [Crimean-Congo hemorrhagic fever, CCHF] in Afghanistan in the past year. 71 cases of the disease have been reported across the country in that time. Congo fever is primarily transmitted to people from ticks or through contact with infected animal blood or tissues during and immediately after slaughter.",2016-09-13,,,,,,71,12
Crimean-Congo Hemorrhagic Fever,"Herat Province, Afghanistan",Afghanistan,35,62,"Congo hemorrhagic fever (CCHF) has killed 13 people in western Herat province this year. Symptoms may include fever, muscle pains, headache, vomiting, diarrhea, and bleeding into the skin. The CCHF virus is typically spread by tick bites or contact with livestock carrying the disease.",2017-09-04,Herat,34.347,62.182,,,,13
Crimean-Congo Hemorrhagic Fever,Afghanistan,Afghanistan,34,66,"Six new cases of Crimean-Congo haemorrhagic fever (CCHF) were reported in the west region, bringing the total numbers of CCHF cases to 79 in 2017. 17 people lost their lives. The virus has been observed in over 30 countries, including in Africa, Asia, the Middle East, and southeastern Europe.",2017-11-22,,,,6,,79,17
Crimean-Congo Hemorrhagic Fever,Afghanistan,Afghanistan,34,66,"The Ministry of Public Health in Afghanistan recently reported an increase in the number of Crimean-Congo haemorrhagic fever (CCHF) cases in the country. In 2017, the total number of cases reported is 237 including 41 deaths (CFR: 17.2 percent). The male to female ratio of cases in 27 out of 34 provinces is 2:1. The high risk groups for contracting CCHF include animal herders, livestock workers, butchers and slaughterhouse workers.",2017-12-23,,,,,,237,41
Crimean-Congo Hemorrhagic Fever,"Herat Province, Afghanistan",Afghanistan,35,62,"In the past 2 months, a total of 36 patients with Crimean Congo haemorrhagic fever have been admitted to Herat Regional Hospital, 4 of whom have died. Distress sales of livestock due to the ongoing drought are suspected to be partly responsible for the higher number of CCHF cases. WHO will hold case management trainings for 160 health workers.",2018-06-22,Herat,34.347,62.182,36,4,,
Crimean-Congo Hemorrhagic Fever,Afghanistan,Afghanistan,34,66,"A total of 41 Congo fever cases were recorded in Herat since [21 Mar 2018]. Crimean-Congo hemorrhagic fever (CCHF) is caused by infection with a tick-borne virus (Nairovirus) in the family _Bunyaviridae. The onset of CCHF is sudden, with initial signs and symptoms including headache, high fever, back pain, stomach pain, and vomiting.",2018-06-28,Herat,34.347,62.182,,,41,
Crimean-Congo Hemorrhagic Fever,Afghanistan,Afghanistan,34,66,"At least 18 cases of Crimean-Congo haemorrhagic fever (CCHF) infection have recently been detected in Afghanistan. This year's total cases of CCHF are 267 compared to 244 cases last year. 33 percent of those infected with the Congo virus this year [2018] were women and the rest men including butchers, shepherds, cooks, and others.",2018-08-27,,,,18,,267,
Crimean-Congo Hemorrhagic Fever,Afghanistan,Afghanistan,34,66,"Afghanistan's Ministry of Public Health (MoPH) said that at least 34 people across the country have died after being diagnosed with Crimean-Congo hemorrhagic fever (CCHF) CCHF is endemic in Africa, the Balkans, the Middle East and Asia. There is no vaccine available for either people or animals.",2018-09-04,,33,66,,,,34
