diseasename,place,country,lat,lon,summary,issue_date,region/city,region/city lat,region/city lon,cases,deaths,total cases,total deaths
Crimean-Congo Hemorrhagic Fever,"Khyber Pakhtunkhwa Province, Pakistan",Pakistan,35,72,"Four days after a suspected outbreak claimed 5 lives in Karak, authorities are still clueless as to what exactly the disease is. Some suspect it to be an outbreak of Acute Watery Diarrhea (AWD) while others believe that it is a strain of the Crimean-Congo hemorrhagic fever (CCHF)",2017-06-07,Al Karak,31.16667,35.75,,5,,
Crimean-Congo Hemorrhagic Fever,"Islamabad City, Islamabad Capital Territory, Pakistan",Pakistan,34,73,"The patient, who comes from Sara-e-Naurang in Khyber-Pakhtunkhwa, is currently under treatment in the isolation ward of medical ward 2 at PIMS. The patient is involved in animal handling and slaughter, which is a high risk group for the disease. The disease of Congo is contracted from animals to humans though it can lead to death.",2017-06-11,Kotka Khali Khel,32.73856,70.75323,1,,,
Crimean-Congo Hemorrhagic Fever,Pakistan,Pakistan,30,69,"Patient brought to the Pakistan Institute of Medical Sciences (PIMS) for treatment of hepatitis on [Sun 4 Jun 2017], has been confirmed by the National Institute of Health as suffering from Crimean Congo Hemorrhagic Fever (CCHF) The patient, who comes from Sara-e-Naurang in Khyber Pakhtunkhwa, is currently under treatment in the isolation ward of medical ward 2 at PIMS.",2017-06-11,Pakistan Institute of Medical Sciences,33.70373269,73.05158294,1,,,
Crimean-Congo Hemorrhagic Fever,"Balochistan, Pakistan",Pakistan,28,66,"One case has been laboratory confirmed for CCHF while the results are awaited for the 2nd case. Raising awareness on preventive measures and ensuring that precautionary measures are taken, particularly by the high-risk groups such as workers in the livestock industry and healthcare is needed. Precautions against tick bites, during contact with animals and infected people will help to reduce the risk of transmission.",2017-07-06,,,,1,,,
Crimean-Congo Hemorrhagic Fever,"Punjab Province, Pakistan",Pakistan,31,72,"The patient belongs to Kalakahar, Chakwal in Punjab. She was admitted with high grade fever, body-aches and hemorrhagic manifestations. She had a few domestic animals at home. The case has a history of contact with domestic livestock and presented with the typical clinical features of CCHF.",2017-07-24,Chakwal,32.93286,72.85394,1,,,
Crimean-Congo Hemorrhagic Fever,"Punjab Province, Pakistan",Pakistan,31,72,"The 1st Congo virus [CCHFv] case was reported at the Allied Hospital here. The CCHF virus is tick borne and can cause severe viral hemorrhagic fever outbreaks. The majority of cases have been reported in people involved in the livestock industry, such as agricultural workers, butchers, veterinarians.",2017-08-06,Allied Hospital,34.08273701,72.61320472,1,,,
Crimean-Congo Hemorrhagic Fever,Pakistan,Pakistan,30,69,"A woman suspected of suffering from Crimean-Congo virus was admitted to the Holy Family Hospital (HFH) on Tuesday [30 Jun 2015]. The circumstances under which the patient acquired her CCHF virus infection are not stated. The virus can cause severe viral hemorrhagic fever outbreaks, with a case fatality rate of 10-40 per cent.",2015-07-01,Rawalpindi,33.59733,73.0479,1,,,
Crimean-Congo Hemorrhagic Fever,"Punjab Province, Pakistan",Pakistan,31,72,"Patient undergoing treatment at one of the 3 teaching hospitals in town, Holy Family Hospital, has been tested positive for Crimean-Congo Hemorrhagic Fever (CCHF) CCHF is caused by Nairovirus of the Bunyaviridae family transmitted to humans by the bite of Hyalomma tick found on the skin of animals including goat and sheep.",2017-08-22,Holy Family Hospital,33.64067,73.05751,1,,,
Crimean-Congo Hemorrhagic Fever,"Balochistan, Pakistan",Pakistan,28,66,"Two people including a woman died of Crimean-Congo haemorrhagic fever (CCHF), commonly known as Congo virus. Balochistan province has been endemic for CCHF for many years, and sporadic cases are reported every year, particularly between May and September/October.",2017-08-30,Balochistan,28.47849,65.64355,2,,,
Crimean-Congo Hemorrhagic Fever,Pakistan,Pakistan,30,69,A suspected patient of Crimean-Congo hemorrhagic fever (CCHF) has been admitted in the Pakistan Institute of Medical Sciences (PIMS) [Islamabad] with symptoms of the disease. The blood samples of the patient from Kashmir were sent to the National Institute of Health (NIH) and he was moved to the isolation ward of the hospital. The incubation period following contact with infected blood or tissues is usually 5 to 6 days.,2017-09-04,Islamabad,33.72148,73.04329,1,,,
Crimean-Congo Hemorrhagic Fever,Pakistan,Pakistan,30,69,"A 27-year-old male patient from Afghanistan has been diagnosed with Crimean-Congo hemorrhagic fever. On Tuesday a woman suspected of suffering from Congo virus was admitted to the Holy Family Hospital (HFH), Rawalpindi. Cases of CCHF occurred in Sindh province, Pakistan, this year (2015) and in various parts of Pakistan last year (2014)",2015-07-05,Rawalpindi,33.59733,73.0479,1,,,
Crimean-Congo Hemorrhagic Fever,Pakistan,Pakistan,30,69,"The deadly Crimean Congo haemorrhagic fever, a tick-borne viral disease, has claimed another life in Karachi. This was confirmed by Jinnah Postgraduate Medical Centre (JPMC)'s Dr Seemin Jamali on Friday [19 Aug 2016]. The victim, 22, son of EB, was a cattle handler and had arrived from Bahawalpur to sell cattle for Eidul Azha 25 days ago.",2016-08-21,Karachi,24.8608,67.0104,,1,,
Crimean-Congo Hemorrhagic Fever,Pakistan,Pakistan,30,69,"CCHF surveillance is ongoing in Balochistan and a fellow of FELTP [Field Epidemiology and Laboratory Training. Program] is assigned by DGHS for updates. During the last week one suspected case was reported. The case was a 58-year-old woman from district Qilla Abdullah, with history of high-grade fever, body aches, bleeding from nose and mouth.",2017-10-09,Balochistan,28.47849,65.64355,1,,,
Crimean-Congo Hemorrhagic Fever,Pakistan,Pakistan,30,69,"A 15-year-old boy was admitted to Jinnah Postgraduate Medical Centre (JPMC) in Karachi [Sindh province] over Congo fever fears. So far 6 people have died from Congo fever in the port city. The Bahawal Victoria Hospital (BVH) [Bahawalpur, Punjab province] officials claim that 10 people including 3 professors have been tested negative for Congo virus.",2016-09-03,Karachi,24.8608,67.0104,1,,,
Crimean-Congo Hemorrhagic Fever,"Karachi, Sindh, Pakistan",Pakistan,25,67,"Crimean-Congo haemorrhagic fever (CCHF) claimed this year's [2016] 10th life in Karachi [Sindh] on [Sun 16 Oct 2016] as a male patient passed away at the Dow University of Health Sciences' (DUHS) Ojha campus hospital. The patient's condition was said to have deteriorated on Sunday morning [16 Oct 2016], and despite being admitted at the special care unit [he] could not be saved. The total number of people to have died of the lethal disease rose to 10 this year [2016], after Eid-ul-Azha [Festival of the Sacrifice]",2016-10-17,Karachi,24.8608,67.0104,,1,,
Crimean-Congo Hemorrhagic Fever,"Islamabad Capital Territory, Pakistan",Pakistan,34,73,"A man has tested positive for the Crimean Congo Hemorrhagic Fever (CCHF) at Pims. CCHF is a tick-borne viral disease with symptoms such as high fever, muscle pain, dizziness, abnormal sensitivity to light, abdominal pain and vomiting. The provincial health department has issued a fresh alert over the possibility of the Congo fever spreading during Eid.",2018-08-09,Sultanate of Oman,21,57,1,,,
Crimean-Congo Hemorrhagic Fever,"Multan, Punjab, Pakistan",Pakistan,30,71,"2 suspected Congo [Crimean-Congo hemorrhagic fever] patients have died at Nishtar Hospital in Multan, Punjab. Tests of the patients were sent to National Institute of Health, Islamabad for confirmation. Pakistan provides an excellent habitat for ticks due to optimal weather conditions including mild winters and warm autumns.",2018-04-24,Multan,30.19679,71.47824,,2,,
Crimean-Congo Hemorrhagic Fever,"Punjab Province, Pakistan",Pakistan,31,72,"Another suspected Congo patient was admitted at Nishtar Hospital, said an official here. The suspected patient had returned from Muscat on [Tue 24 Apr 2018], the source informed, adding that though the expatriate was a driver by profession he had the history of handling cattle in Muscat. Meanwhile, [ZS] (40) w/o Bismillah Khan, resident of Wana KPK, and another suspected patient [AQ] (50) s/o Musa khan who belonged to DG Khan died on [Mon 23 Apr 2018] night and were tested negative for Congo today.",2018-04-27,Nishtar Hospital,30.20514846,71.44185126,1,,,
Crimean-Congo Hemorrhagic Fever,"Sindh, Pakistan",Pakistan,26,69,"A 30-year-old man who died of the deadly Crimean-Congo hemorrhagic fever at a private hospital a day ago became the 1st citizen of Karachi to have been killed by the virus this year. The total number of Congo fever deaths reported in the city so far this year [2017] has reached 5. Since April 2017, a total of 4 people, all from Quetta, have died at different private hospitals in Karachi.",2017-09-23,Karachi,24.8608,67.0104,1,1,,6
Crimean-Congo Hemorrhagic Fever,"Multan, Punjab, Pakistan",Pakistan,30,71,"Crimean-Congo hemorrhagic fever, commonly referred to as Congo fever has claimed another life in Multan district of Punjab. Congo fever is a tick-borne viral disease which is mainly transferred to humans from pets. Its symptoms include fever, flu, bloody urine, vomiting, and nose bleeding.",2018-05-08,Multan,30.19679,71.47824,,1,,
Crimean-Congo Hemorrhagic Fever,"Murree, Punjab, Pakistan",Pakistan,34,73,"A patient suffering from Crimean-Congo hemorrhagic fever (CCHF) for the last 3 months has died in Rawalpindi, Punjab. The source of the infection is not mentioned in the news report above. The total number of causalities due to Congo virus has reached 3.",2015-10-22,Rawalpindi,33.59733,73.0479,,1,,
Crimean-Congo Hemorrhagic Fever,Pakistan,Pakistan,30,69,A 21-year-old man in Karachi has contracted Crimean-Congo haemorrhagic fever (CCHF) and been admitted to the isolation ward of the Jinnah Postgraduate Medical Centre (JPMC) in critical condition. CCHF is a lethal disease caused by a virus found in a tick that attaches itself to the bodies of livestock and cattle.,2017-10-22,Karachi,24.8608,67.0104,1,,,
Crimean-Congo Hemorrhagic Fever,"Karachi, Sindh, Pakistan",Pakistan,25,67,"Crimean-Congo hemorrhagic fever (CCHF) claimed the 1st life of the year [2018] in Karachi. A 36-year-old resident of Lyari died at Liaquat National Hospital due to complications of the lethal tick-borne disease. His brother said his brother, who was married with 4 small children, used to visit a cattle pen in the area.",2018-05-06,Karachi,24.8608,67.0104,,1,,
Crimean-Congo Hemorrhagic Fever,"Sindh, Pakistan",Pakistan,26,69,"The patient, M.A., is a resident of Korangi Industrial Area and works at a tannery where labourers deal with hides of cattle, and sometimes they contract the viral disease. The CCHF is caused by the Congo virus, which is found on a tick that attaches itself to the skin of cattle. The disease is highly contagious and has a 40-50 per cent mortality rate.",2018-06-13,Korangi Industrial Area,24.83601,67.11603,1,,,
Crimean-Congo Hemorrhagic Fever,"Quetta, Balochist?n, Pakistan",Pakistan,30,67,"An 18 year old patient was admitted to Jinnah Postgraduate Medical Centre (JPMC) in Karachi. The patient tested positive for Congo virus, commonly known as Congo virus. CCHF is a viral disease typically spread by tick bites or contact with livestock carrying the disease. There is currently no vaccine available for humans.",2018-06-09,Karachi,24.8608,67.0104,1,,,
Crimean-Congo Hemorrhagic Fever,"Khyber Pakhtunkhwa Province, Pakistan",Pakistan,35,72,"A man died of Crimean-Congo hemorrhagic fever (CCHF), commonly known as Congo virus, at Jinnah Postgraduate Medical Centre (JPMC) on [Sun 30 Sep 2018], raising the death toll due to the disease to 11 in Karachi in the ongoing year. A teenage boy from Dhaki Sahib Gul Mohallah of Charsadda district died of Congo virus [infection] in a hospital in Peshawar.",2018-10-02,Sultanate of Oman,21,57,,2,,
Crimean-Congo Hemorrhagic Fever,"Punjab Province, Pakistan",Pakistan,31,72,"The Department of Infectious Diseases [DID] at Holy Family Hospital [HFH] in town [Rawalpindi, Punjab] received a total of 17 suspected patients of Crimean-Congo hemorrhagic fever (CCHF) so far in the year 2018. Of these, only 3 were tested positive for CCHF; however experts still believe that people must follow preventive measures while dealing with sacrificial animals ahead of Eidul Azha.",2018-08-21,Holy Family Hospital,33.64067,73.05751,,,17,
Crimean-Congo Hemorrhagic Fever,"Sindh, Pakistan",Pakistan,26,69,"A 23-year-old man with Crimean-Congo hemorrhagic fever (CCHF) was admitted to one of its isolation wards. CCHF is a tick-borne, potentially lethal viral disease with 30-40 per cent mortality rate. The patient's condition was critical due to extremely low platelets and total leucocytes counts.",2018-08-22,,,,1,,,
Crimean-Congo Hemorrhagic Fever,"Sindh, Pakistan",Pakistan,26,69,"A teenager tested positive for the dreaded Congo Crimean Hemorrhagic Fever (CCHF) in Karachi and admitted to an isolation ward at Jinnah Postgraduate Medical Centre. The patient, M.A., is a resident of Korangi Industrial Area and works at a tannery where labourers deal with hides of cattle, and sometimes they contract the viral disease. The CCHF is caused by the Congo virus, which is found on a tick that attaches itself to the skin of cattle. It is highly contagious disease and has a 40-50 per cent mortality rate.",2018-06-12,Karachi,24.8608,67.0104,1,,,
Crimean-Congo Hemorrhagic Fever,Pakistan,Pakistan,30,69,2 CCHF positive cases are admitted at Holy Family Hospital in Rawalpindi. Both cases are from District Chakwal and are brother and sister. They have cattle at home and are farmers by profession. Both are stable and are recovering. Almost 35 close contacts are under observation.,2015-12-08,Rawalpindi,33.59733,73.0479,2,,,
Crimean-Congo Hemorrhagic Fever,"Khyber Pakhtunkhwa Province, Pakistan",Pakistan,35,72,"The contagious Congo virus claimed the life of another young man on [Sun 2 Sep 2018], K.H., from Piro Khel village of Landi Kotal division, Khyber Pakthunkhwa (KP) The death was the 2nd case of Congo virus in the region after the 1st case of S.S., a 20-years old young man, who died of virus in Islamabad hospital on [Sat 1 Sep 2018].",2018-09-04,,,,1,1,,
Crimean-Congo Hemorrhagic Fever,"Khyber Pakhtunkhwa Province, Pakistan",Pakistan,35,72,"Emergency was declared in Khyber area after two persons died in Landi Kotal due to Congo fever [Crimean-Congo hemorrhagic fever; CCHF], doctors said. Family sources said that S.K., a resident of Peerokhel locality, had slaughtered a number of sacrificial animals on Eidul Azha day.",2018-09-06,Khyber Agency,33.96113,71.0577,,2,,
Crimean-Congo Hemorrhagic Fever,"Sindh, Pakistan",Pakistan,26,69,"Karachi (Sindh) registered its second case of ""Congo virus"" induced mortality in the current year [2018] with a 19 year old being the latest victim along with a patient who died last month [May 2018] due to Congo Hemorrhagic Fever. The patient was under treatment at Jinnah Postgraduate Medical Center (JPMC) and died on Wed 13 Jun 2018 bringing the total number of deaths to 2 from Sindh during 2018 among 4 cases reported so far.",2018-06-17,Karachi,24.8608,67.0104,4,1,,
Crimean-Congo Hemorrhagic Fever,"Karachi, Sindh, Pakistan",Pakistan,25,67,"A 65-year-old man from Balochistan has been admitted to the Jinnah Postgraduate Medical Centre (JPMC) in Karachi, Sindh. The patient's condition is critical due to haemorrhage and low count of platelets. So far this year, 7 people have died from Crimean-Congo haem orrhagic fever in Karachi.",2018-09-02,Karachi,24.8608,67.0104,1,,,7
Crimean-Congo Hemorrhagic Fever,Pakistan,Pakistan,30,69,"A teenage boy from Dhaki Sahib Gul Mohallah of Charsadda district died of Congo virus [infection] in a hospital in Peshawar on [Fri 28 Sep 2018]. A.S., uncle of deceased A., 17, told media people that his nephew, a grade 10th student, fell ill and was admitted to Tangi hospital.",2018-10-01,Charsadda,34.14822,71.7406,1,1,,
Crimean-Congo Hemorrhagic Fever,"Zhob District, Balochist?n, Pakistan",Pakistan,31,69,The death toll from Crimean-Congo hemorrhagic fever (CCHF) reached 4 in a week in Zhob district of Balochistan province. The virus is primarily transmitted to people from ticks and livestock animals. In total of 77 suspected cases of CCHF were reported from Pakistan between 1 and 29 Sept. 2013.,2014-08-18,Zhob District,31.36444,69.20749,77,4,,
Crimean-Congo Hemorrhagic Fever,"Sindh, Pakistan",Pakistan,26,69,"A 25-year-old man died at Jinnah hospital in Karachi. The man was a resident of Mehmoodabad [Mahmudabad, Malir district] and was brought to the hospital 2 days ago. So far, 10 CCHF patients have died in the city -- 3 at JPMC, 7 at private health facilities.",2018-09-12,Karachi,24.8608,67.0104,1,1,,
Crimean-Congo Hemorrhagic Fever,"Khyber Pakhtunkhwa, Pakistan",Pakistan,34,73,Congo virus has been detected in Booni Chitral district after a butcher of Afghan nationality has been tested positive. Two butcher shops in the area have been sealed and the butchers and family members asked to undergo testing for the virus. Residents of the area immediately expressed their fear and demanded from the government to send special medical teams to the area.,2018-12-10,Booni Chitral,36.27506494,72.25642574,1,,,
Crimean-Congo Hemorrhagic Fever,"Orangi Town, Sindh, Pakistan",Pakistan,25,67,"The city's 1st case in 2019 of Crimean-Congo haemorrhagic fever (CCHF), commonly known as Congo virus, was reported. The patient was identified as 35-year-old [TF], resident of Orangi Town. She is currently under treatment at an isolated ward of the Jinnah Postgraduate Medical Centre.",2019-02-12,Orangi Town,24.95190253,67.00256581,1,,,
Crimean-Congo Hemorrhagic Fever,"Malir, Sindh, Pakistan",Pakistan,28,69,"Another case of Crimean-Congo haemorrhagic fever (CCHF), commonly known as Congo virus, has been reported in Karachi. CCHF is a lethal disease with 40 per cent mortality rate. The disease is caused when a person comes in contact with an infected animal, which has parasitic ticks on its body.",2018-10-24,Karachi,24.8608,67.0104,1,,,
Crimean-Congo Hemorrhagic Fever,Pakistan,Pakistan,30,69,"A 75-year-old man died of Congo virus complications at Jinnah Postgraduate Medical Centre (JPMC) on early [Sun 17 Feb 2019] morning, becoming the 2nd victim of the deadly tick-borne disease in the city [Karachi] in 2019. A 35-year old woman from Orangi Town had died of the disease earlier in the week. The disease is caused when a person comes in contact with an animal infected with the Congo virus.",2019-02-19,Karachi,24.8608,67.0104,1,1,,2
Crimean-Congo Hemorrhagic Fever,"Karachi, Sindh, Pakistan",Pakistan,25,67,"Crimean-Congo hemorrhagic fever claimed 3 lives in Karachi in June [2019], citing local health department officials. Doctors have expressed apprehensions of an outbreak of Congo virus in the city with the arrival of sacrifice animals to Karachi for sale ahead of the Eid ul-Azha [11-12 Aug 2019]. Director, health and medical services department of the Karachi Metropolitan Corporation (KMC), has issued a health alert.",2019-07-04,Karachi,24.8608,67.0104,,,,3
Crimean-Congo Hemorrhagic Fever,"Khyber Pakhtunkhwa Province, Pakistan",Pakistan,35,72,At least 2 people have been admitted in the Hayatabad Medical Complex with symptoms similar to that of the Crimean-Congo hemorrhagic fever (CCHF) A hospital spokesperson told The Express Tribune that 2 young men had been brought to the facility with complaints of high fever. Their blood samples have been sent to the National Institute of Health to test and confirm any antigens in the blood.,2019-07-09,Hayatabad Medical Complex,33.99244,71.45033,2,,,
Crimean-Congo Hemorrhagic Fever,Pakistan,Pakistan,30,69,"2 farmers in the Zhob district of Balochistan have died after suffering from Crimean-Congo haemorrhagic fever (CCHF), also known as Congo virus. At least 4 people, including a woman, were infected with the virus in the small village of Killi Blump near Meena Bazaar. The virus is primarily transmitted to people from ticks and livestock animals. Human-to-human transmission can also occur.",2014-08-18,Zhob District,31.36444,69.20749,4,2,,
Crimean-Congo Hemorrhagic Fever,"Attock District, Punjab, Pakistan",Pakistan,33,72,"A 20-year-old man died of Congo fever [Crimean-Congo hemorrhagic fever] in Holy Family Hospital [Rawalpindi] on [Thu 8 Sep 2016], Geo News reported. Health experts are advising citizens to take special preventive measures to avoid contracting the virus ahead of Eid ul-Azha. The 2nd of 2 Muslim holidays celebrated worldwide each year; this year in Pakistan, 12-14 Sep 2016.",2016-09-09,Rawalpindi,33.59733,73.0479,,1,,
Crimean-Congo Hemorrhagic Fever,"Sindh, Pakistan",Pakistan,26,69,"A man died of Crimean-Congo hemorrhagic fever (CCHF), commonly known as Congo virus, at a private hospital of the metropolis on Sunday [28 Jul 2019], raising the death toll due to the disease to 5 in Karachi in the ongoing year. The circumstances under which this latest case acquired his infection are not mentioned.",2019-07-29,Karachi,24.8608,67.0104,1,1,,
Crimean-Congo Hemorrhagic Fever,"Karachi, Sindh, Pakistan",Pakistan,25,67,Another Congo-related death was reported in Karachi as a 27-year-old patient passed away due to the fever on [Sun 28 Jul 2019]. This brings the death toll of the disease to 6 this year [2019]. Dr Falak Qadir explained how Congo virus spreads and shared tips on protecting oneself from Congo fever on SAMAA TV.,2019-08-01,Karachi,24.8608,67.0104,,1,,6
Crimean-Congo Hemorrhagic Fever,"Sindh, Pakistan",Pakistan,26,69,"A 70-year-old man from District Naushehro Feroz died due to Congo Crimean hemorrhagic fever (CCHF) at a private hospital in Karachi a couple of days back. Officials said another person, aged 25 and identified as [SA], a resident of North Nazimabad, was battling for life at the Aga Khan University Hospital, Karachi. CCHF is a lethal viral infection that is transmitted to humans from animals, especially cattle and livestock. Mortality is around 40 percent.",2019-08-19,Karachi,24.8608,67.0104,1,1,,
Crimean-Congo Hemorrhagic Fever,"Karachi, Sindh, Pakistan",Pakistan,25,67,"A teenage boy succumbed to Crimean-Congo hemorrhagic fever (CCHF) in the metropolis on Fri 9 Aug 2019. The teenager, who was admitted 4 days ago in the Jinnah Hospital, was identified as a resident of Orangi Town. He becomes the 8th [or 9th] victim of CCHF during the ongoing year [2019].",2019-08-11,Orangi Town,24.95190253,67.00256581,,1,,8
Crimean-Congo Hemorrhagic Fever,Pakistan,Pakistan,30,69,"Two more Crimean-Congo haemorrhagic fever (CCHF) cases surfaced in the city [Karachi] on Thursday, taking the reported toll of cases to 27 in the provincial metropolis during the current year (2019) In 2018, at least 16 deaths had been reported in Karachi from the life-threatening virus, whereas 41 patients -- majorly from Quetta, Balochistan -- were diagnosed.",2019-08-26,Karachi,24.8608,67.0104,2,,27,
Crimean-Congo Hemorrhagic Fever,Pakistan,Pakistan,30,69,"17-year-old boy diagnosed with Congo virus after being admitted at a hospital in Nazimabad area. Congo virus alert had been issued for the metropolis, stipulating precautionary instructions for all those people who visit cattle farms. The disease is caused when a tick attaches itself to the skin of cattle, and when that infected tick or animal comes in contact with people, the highly contagious virus is transmitted.",2019-08-21,Nazimabad,24.91390566,67.03012193,1,,,
Crimean-Congo Hemorrhagic Fever,Pakistan,Pakistan,30,69,"Karachi seems to be in the grip of deadly diseases, as Sindh Health Department officials said on Mon 26 Aug 2019 that 3 more people had fallen victim to the tick-borne Crimean-Congo haemorrhagic fever. Pakistan Field Epidemiology & Laboratory Training Program (FELTP) officials told The News that August (2019) had proved to be the deadliest month with respect to deaths due to CCHF in Karachi.",2019-08-30,Karachi,24.8608,67.0104,,3,,
Crimean-Congo Hemorrhagic Fever,"Sindh, Pakistan",Pakistan,26,69,"A Crimean-Congo Haemorrhagic Fever (CCHF) patient died in a private hospital of Karachi. The death toll from the tick-born viral disease has climbed to 17 in the megacity this year. CCHF is a fatal viral disease that spreads through a tick bite. The symptoms include backache, joints pain, fever and bleeding from any part of the body.",2019-09-15,Karachi,24.8608,67.0104,1,1,,17
Crimean-Congo Hemorrhagic Fever,"Punjab Province, Pakistan",Pakistan,31,72,Patient tested positive for Crimean-Congo hemorrhagic fever (CCHF) in Rawalpindi. CCHF is a widespread disease caused by a tickborne virus (Nairovirus) of the Bunyaviridae family with a case fatality rate of 10 to 40 per cent.,2017-08-21,Rawalpindi,33.59733,73.0479,1,,,
Crimean-Congo Hemorrhagic Fever,"Sindh, Pakistan",Pakistan,26,69,"A Crimean-Congo haemorrhagic fever (CCHF) patient died in a private Karachi hospital, and the death toll from the tick-borne viral disease climbed to 17 in the megacity this year. 36 CCHF-positive cases have been reported from Sindh province, out of which 17 patients have died due to the viral illness. The symptoms of Congo virus include backache, joint pain, pain in the abdomen, high-grade fever and bleeding from any part of the body.",2019-09-18,Karachi,24.8608,67.0104,,1,,
